{
  "schema_version": "0.1",
  "evidence_type": "automated.test-summary",
  "source": "VeriTrail M7 pairing fixture",
  "captured_at": "2026-08-09T00:00:01+08:00",
  "facts": {
    "suite_passed": false,
    "failures": 1,
    "tests": 1
  },
  "observed_variables": {
    "experiment_condition": "forced_failure",
    "python_major_minor": "3.10"
  }
}
