{"captured_at":"2026-08-08T23:12:31.781359Z","evidence_type":"runtime.preflight","facts":{"collection_elapsed_ms":141.0,"collection_errors":[],"collector_version":"resource-preflight/0.1","decision":"PROCEED","decision_reasons":[],"environment":{"cpu_logical_count":24,"memory_total_mb":16160,"operating_system":{"machine":"AMD64","release":"10","system":"Windows","version":"10.0.26200"},"proxy":{"all_configured":true,"http_configured":true,"https_configured":true,"no_proxy_configured":true},"python":{"implementation":"CPython","version":"3.10.6"},"timezone_offset_minutes":480},"environment_fingerprint":"47ab2976c4e7c52af06d3afb8e8472b2ae0e0b3300ffaf0fa734714a69b8725e","max_consecutive_memory_hard_breaches":0,"observer_effect":{"rss_delta_mb":0.308,"rss_peak_mb":20.023,"rss_start_mb":19.715},"policy":{"available_memory_hard_min_mb":2048,"available_memory_soft_min_mb":4096,"collector_rss_hard_max_mb":128,"disk_free_hard_min_mb":1024,"hard_breach_grace_samples":2,"observer_rss_delta_soft_max_mb":32,"ports":[{"expected":"LISTENING","port":18765}],"require_clean_staging":true,"sample_count":3,"sampling_interval_ms":50},"port_checks":[{"actual":"LISTENING","expected":"LISTENING","matched":true,"port":18765}],"sample_count_expected":3,"sample_count_observed":3,"samples":[{"available_memory_mb":8306.949,"captured_at":"2026-08-08T23:12:31.783761Z","collector_rss_mb":20.008,"disk_free_mb":152033.496,"disk_total_mb":307200.996,"memory_total_mb":16159.867},{"available_memory_mb":8306.531,"captured_at":"2026-08-08T23:12:31.837184Z","collector_rss_mb":20.012,"disk_free_mb":152033.496,"disk_total_mb":307200.996,"memory_total_mb":16159.867},{"available_memory_mb":8303.879,"captured_at":"2026-08-08T23:12:31.887706Z","collector_rss_mb":20.023,"disk_free_mb":152033.496,"disk_total_mb":307200.996,"memory_total_mb":16159.867}],"snapshot_complete":true,"staging":{"clean_required":true,"residue_count":0}},"metadata":{"environment_values_redacted":true,"network_scope":"loopback-only"},"observed_variables":{},"schema_version":"0.1","source":"VeriTrail resource-preflight/0.1"}