{
  "schema_version": "0.1",
  "evidence_type": "automated.test-summary",
  "source": "VeriTrail deterministic fixture",
  "captured_at": "2026-08-09T00:00:00+08:00",
  "facts": {
    "suite_passed": true,
    "failures": 0,
    "tests": 1
  },
  "observed_variables": {
    "fixture_mode": "passing",
    "python_major_minor": "3.10"
  },
  "metadata": {
    "authorization": "synthetic fixture value that must be redacted"
  }
}
