{"captured_at":"2026-08-08T23:12:32.039774Z","evidence_type":"browser.session","facts":{"all_steps_passed":true,"allowed_origins":["http://localhost:18765"],"browser_engine":"chromium","browser_version":"151.0.7922.34","capture_complete":true,"cleanup_complete":true,"collection_errors":[],"collector_version":"browser-playwright/0.1","console":[{"captured_at":"2026-08-08T23:12:33.077122Z","level":"info","text":"fixture evidence loaded","viewport":"desktop"},{"captured_at":"2026-08-08T23:12:33.776992Z","level":"info","text":"fixture evidence loaded","viewport":"mobile"}],"duplicate_write_request_group_count":0,"duplicate_write_request_groups":[],"ended_at":"2026-08-08T23:12:33.888261Z","failed_request_count":0,"headless":true,"horizontal_overflow_viewport_count":0,"network":[{"captured_at":"2026-08-08T23:12:32.492088Z","failure":null,"finished":true,"method":"GET","redirected_from":null,"resource_type":"document","sequence":1,"status":200,"url":"http://localhost:18765/index.html","viewport":"desktop"},{"captured_at":"2026-08-08T23:12:32.961369Z","failure":null,"finished":true,"method":"GET","redirected_from":null,"resource_type":"fetch","sequence":2,"status":200,"url":"http://localhost:18765/data.json?run=%5BREDACTED%5D","viewport":"desktop"},{"captured_at":"2026-08-08T23:12:33.204910Z","failure":null,"finished":true,"method":"GET","redirected_from":null,"resource_type":"document","sequence":3,"status":200,"url":"http://localhost:18765/index.html","viewport":"mobile"},{"captured_at":"2026-08-08T23:12:33.593908Z","failure":null,"finished":true,"method":"GET","redirected_from":null,"resource_type":"fetch","sequence":4,"status":200,"url":"http://localhost:18765/data.json?run=%5BREDACTED%5D","viewport":"mobile"}],"page_error_count":0,"page_errors":[],"playwright_version":"1.62.0","policy_sha256":"96df1c3d06de845b69ff7176de7a1cfa9356525e97863bf8500bd5549974199d","screenshot_count":2,"screenshots":[{"media_type":"image/png","name":"ready","path":"attachments/browser/desktop/001-ready.png","sha256":"b14acc19053711225bd6c93c77739cd9a59d91647ccd1babbe82036225e42748","size":33066,"step_id":"capture-ready","viewport":"desktop"},{"media_type":"image/png","name":"ready","path":"attachments/browser/mobile/001-ready.png","sha256":"dbb8683146d05ca3b2ea6d4d0581fe8f87bc9eb4720fd321baddb19b227fa2f0","size":30659,"step_id":"capture-ready","viewport":"mobile"}],"start_url":"http://localhost:18765/index.html","started_at":"2026-08-08T23:12:32.039774Z","steps":[{"action":"goto","elapsed_ms":438.0,"ended_at":"2026-08-08T23:12:32.907243Z","error":null,"error_type":null,"started_at":"2026-08-08T23:12:32.474362Z","status":"PASSED","step_id":"browser-start","viewport":"desktop"},{"action":"fill","elapsed_ms":16.0,"ended_at":"2026-08-08T23:12:32.932635Z","error":null,"error_type":null,"started_at":"2026-08-08T23:12:32.907243Z","status":"PASSED","step_id":"enter-run-label","viewport":"desktop"},{"action":"click","elapsed_ms":31.0,"ended_at":"2026-08-08T23:12:32.963267Z","error":null,"error_type":null,"started_at":"2026-08-08T23:12:32.932635Z","status":"PASSED","step_id":"load-evidence","viewport":"desktop"},{"action":"expect_text","elapsed_ms":140.0,"ended_at":"2026-08-08T23:12:33.092122Z","error":null,"error_type":null,"started_at":"2026-08-08T23:12:32.963267Z","status":"PASSED","step_id":"wait-until-ready","viewport":"desktop"},{"action":"expect_visible","elapsed_ms":0.0,"ended_at":"2026-08-08T23:12:33.095570Z","error":null,"error_type":null,"started_at":"2026-08-08T23:12:33.092122Z","status":"PASSED","step_id":"evidence-list-visible","viewport":"desktop"},{"action":"screenshot","elapsed_ms":32.0,"ended_at":"2026-08-08T23:12:33.123107Z","error":null,"error_type":null,"started_at":"2026-08-08T23:12:33.095570Z","status":"PASSED","step_id":"capture-ready","viewport":"desktop"},{"action":"goto","elapsed_ms":328.0,"ended_at":"2026-08-08T23:12:33.538219Z","error":null,"error_type":null,"started_at":"2026-08-08T23:12:33.202501Z","status":"PASSED","step_id":"browser-start","viewport":"mobile"},{"action":"fill","elapsed_ms":31.0,"ended_at":"2026-08-08T23:12:33.561045Z","error":null,"error_type":null,"started_at":"2026-08-08T23:12:33.538219Z","status":"PASSED","step_id":"enter-run-label","viewport":"mobile"},{"action":"click","elapsed_ms":31.0,"ended_at":"2026-08-08T23:12:33.594835Z","error":null,"error_type":null,"started_at":"2026-08-08T23:12:33.561045Z","status":"PASSED","step_id":"load-evidence","viewport":"mobile"},{"action":"expect_text","elapsed_ms":188.0,"ended_at":"2026-08-08T23:12:33.782849Z","error":null,"error_type":null,"started_at":"2026-08-08T23:12:33.594835Z","status":"PASSED","step_id":"wait-until-ready","viewport":"mobile"},{"action":"expect_visible","elapsed_ms":0.0,"ended_at":"2026-08-08T23:12:33.787848Z","error":null,"error_type":null,"started_at":"2026-08-08T23:12:33.782849Z","status":"PASSED","step_id":"evidence-list-visible","viewport":"mobile"},{"action":"screenshot","elapsed_ms":31.0,"ended_at":"2026-08-08T23:12:33.814547Z","error":null,"error_type":null,"started_at":"2026-08-08T23:12:33.787848Z","status":"PASSED","step_id":"capture-ready","viewport":"mobile"}],"unexpected_console_error_count":0,"unexpected_http_error_count":0,"viewport_count":2,"viewport_runs":[{"ended_at":"2026-08-08T23:12:33.129106Z","height":720,"horizontal_overflow_px":0,"is_mobile":false,"name":"desktop","network_request_count":2,"started_at":"2026-08-08T23:12:32.389707Z","status":"PASSED","step_count":6,"width":1280},{"ended_at":"2026-08-08T23:12:33.819821Z","height":844,"horizontal_overflow_px":0,"is_mobile":true,"name":"mobile","network_request_count":2,"started_at":"2026-08-08T23:12:33.129106Z","status":"PASSED","step_count":6,"width":390}]},"metadata":{"contexts_parallel":false,"maximum_live_pages":1,"network_scope":"loopback-only","query_values_redacted":true,"request_bodies_persisted":false,"request_headers_persisted":false,"response_bodies_persisted":false,"response_headers_persisted":false},"observed_variables":{"browser_engine":"chromium","browser_headless":true,"viewport_profile_count":2},"schema_version":"0.1","source":"VeriTrail browser-playwright/0.1"}